<?xml version="1.0" encoding="UTF-8"?>
<file xmlns:xsi="http://www.w3.org/2001/XMLSchema-instance"
                    xsi:noNamespaceSchemaLocation="meta.xsd">
    <type>1</type>
    <tradeCodes>
        <tradeCode>2</tradeCode>
        <tradeCode>3</tradeCode>
    </tradeCodes>
	<orgCodes>
        <orgCode>3</orgCode>
    </orgCodes>
    <encrypt>false</encrypt>
    <fileName>渤海理财文件上报</fileName>
    <ruleId>100</ruleId>
    <splitChar>,</splitChar>
	<source>1</source>
    <lines>
        <headers>
            <columnName>流水号</columnName>
            <columnName>合同号</columnName>
        </headers>
        <contents>
            <columnDetail>
                <columnTag>ContractId</columnTag>
                <columnFormat>1</columnFormat>
                <columnCheckMethod>1</columnCheckMethod>
                <dataMask>true</dataMask>
            </columnDetail>
            <columnDetail>
                <columnTag>InstructionId</columnTag>
                <columnFormat></columnFormat>
                <columnCheckMethod>1</columnCheckMethod>
                <dataMask>true</dataMask>
            </columnDetail>
        </contents>
    </lines>
</file>
